{
  "schema_version": "1.1.0",
  "student_id": "S001",
  "case_id": "shuping-teaching-v1",
  "submission_sha256": "5c05263c7f963c39a54280040961ccc745880117e9d4a1d9da62109236496ac2",
  "feedback_sha256": "8bbc04b19d46e92ebb986c8a7400ff9d3a3f4ff816acc1e2c6a658c60e46b814",
  "requires_teacher_signoff": true,
  "disposition": "revise_feedback",
  "checks": [
    {
      "dimension": "problem_identification",
      "verdict": "suspect",
      "issue_ids": [],
      "anchor": {
        "paragraph_id": "P01",
        "quote": "教学模拟报告片段。库水位下降必然导致孔压上升，故滑坡一定发生；这一断言需要核查。"
      },
      "citations": [
        {
          "claim_id": "C01",
          "source_id": "ZOU2021",
          "locator": "2.2 Driving–resisting model; 3.1 Geological setting"
        }
      ],
      "reason": "最高档建议缺少依据。P01只表明滑坡问题和待核查断言；P02补充库岸与航运受体，但未区分滑体、滑面、驱动段与抗滑段，也未给出问题边界和优先级。反馈把“相关内容完整”作为3档理由，未逐项核对量规。材料自称报告片段，是否要求这些内容须由教师确认，不能据此直接判为学生低水平。"
    },
    {
      "dimension": "evidence_extraction",
      "verdict": "suspect",
      "issue_ids": [],
      "anchor": {
        "paragraph_id": "P01",
        "quote": "这一断言需要核查。"
      },
      "citations": [
        {
          "claim_id": "C03",
          "source_id": "ZOU2021",
          "locator": "5.3 Scenario 3; 6 Discussion"
        }
      ],
      "reason": "反馈未使用已提供的E01证据卡，却建议3档。E01已给出来源、位置并说明文献机制不等于本报告有实测孔压证据；应保留这一正确边界。现有材料未呈现多来源交叉核验、单位与时段检查或冲突处理，不能认定已满足3档；也不能把没有真实监测数据等同于完全无证据。"
    },
    {
      "dimension": "reasoning_chain",
      "verdict": "suspect",
      "issue_ids": [],
      "anchor": {
        "paragraph_id": "P01",
        "quote": "教学模拟报告片段。库水位下降必然导致孔压上升，故滑坡一定发生；这一断言需要核查。"
      },
      "citations": [
        {
          "claim_id": "C03",
          "source_id": "ZOU2021",
          "locator": "5.3 Scenario 3; 6 Discussion"
        }
      ],
      "reason": "存在major专业错误：反馈称“库水位下降必然导致孔压上升”成立且无需补证，与C03明确相反；该来源不能支持孔压方向必然化，更不能支持滑坡一定发生。原文末尾已写“这一断言需要核查”，A01也否认确定性方向；不能把学生的待核查命题当作已认可结论。应撤销该背书，要求按条件与中间机制完成核查后再建议等级。"
    },
    {
      "dimension": "hazard_chain",
      "verdict": "suspect",
      "issue_ids": [],
      "anchor": {
        "paragraph_id": "P02",
        "quote": "假设滑体快速入水，需进一步核查涌浪传播路径、库岸暴露与航运受体。该情境不是已发生的树坪灾害事件。"
      },
      "citations": [],
      "reason": "反馈用P01支撑灾害链3档，定位不对应。P02已明确快速入水是教学假设，并识别传播路径、库岸和航运受体，不能误判为既成历史事件。现有片段仅提出待核查项目，尚未展示触发与传播条件、情景比较、阻断环节或逐边证据和假设，3档缺少依据。"
    },
    {
      "dimension": "uncertainty",
      "verdict": "suspect",
      "issue_ids": [],
      "anchor": {
        "paragraph_id": "P01",
        "quote": "这一断言需要核查。"
      },
      "citations": [
        {
          "claim_id": "C03",
          "source_id": "ZOU2021",
          "locator": "5.3 Scenario 3; 6 Discussion"
        }
      ],
      "reason": "反馈短引文停在“这一断言”，遗漏紧随其后的核查限定。P02区分假设与历史，A01和E01说明缺少孔压实测及文献证据边界，均应被认可。反馈却背书必然因果并要求直接保留，削弱了已有的不确定性表达。材料尚未充分说明不确定性如何改变结论、建议及补证优先级，不能仅凭泛称完整给出3档。"
    },
    {
      "dimension": "mitigation_match",
      "verdict": "suspect",
      "issue_ids": [],
      "anchor": {
        "paragraph_id": "REPORT",
        "quote": null
      },
      "citations": [
        {
          "claim_id": "C04",
          "source_id": "ZOU2021",
          "locator": "Abstract; 6 Discussion"
        }
      ],
      "reason": "现有两个段落、学习笔记和证据卡没有提出防治措施，反馈仍认定完整并给3档，缺少可核查依据。需先确认报告片段是否包含本维任务，再考虑补交或暂缓等级建议；不能把片段缺项直接转成正式低分。C04只能提供需核查条件的文献措施线索，不授权编造治理尺寸、阈值或效果。"
    }
  ],
  "omissions": [
    {
      "dimension": "reasoning_chain",
      "anchor": {
        "paragraph_id": "P01",
        "quote": "教学模拟报告片段。库水位下降必然导致孔压上升，故滑坡一定发生；这一断言需要核查。"
      },
      "citations": [
        {
          "claim_id": "C03",
          "source_id": "ZOU2021",
          "locator": "5.3 Scenario 3; 6 Discussion"
        }
      ],
      "problem": "反馈遗漏了尚未完成的机制核查，并错误把已被学生标为待核查的断言确认为成立。",
      "suggested_check": "要求区分库水位与坡内地下水响应，逐步说明地下水时滞、渗流和力学作用及适用条件；现无孔压原始记录，不指定孔压必然升降，也不由此推出必然滑坡。"
    },
    {
      "dimension": "hazard_chain",
      "anchor": {
        "paragraph_id": "P02",
        "quote": "假设滑体快速入水，需进一步核查涌浪传播路径、库岸暴露与航运受体。该情境不是已发生的树坪灾害事件。"
      },
      "citations": [],
      "problem": "反馈未指出“需进一步核查”仍是任务清单，尚不是主灾、传播过程、暴露受体相对应的完整灾害链论证。",
      "suggested_check": "在教师确认作业范围后，逐边列出快速入水、涌浪传播和受体暴露的条件及证据或假设，比较阻断环节；保留情境不是历史事件的限定。"
    },
    {
      "dimension": "problem_identification",
      "anchor": {
        "paragraph_id": "REPORT",
        "quote": null
      },
      "citations": [
        {
          "claim_id": "C01",
          "source_id": "ZOU2021",
          "locator": "2.2 Driving–resisting model; 3.1 Geological setting"
        }
      ],
      "problem": "反馈未识别现有片段缺少空间对象分段、问题边界及优先级，因而无法验证其最高档建议。",
      "suggested_check": "先确认这是否为完整作业及该阶段要求；若本次任务要求完整判读，再补充滑体、滑面、驱动段与抗滑段和受体的对应关系，不把未提交部分推定为错误。"
    },
    {
      "dimension": "mitigation_match",
      "anchor": {
        "paragraph_id": "REPORT",
        "quote": null
      },
      "citations": [
        {
          "claim_id": "C04",
          "source_id": "ZOU2021",
          "locator": "Abstract; 6 Discussion"
        }
      ],
      "problem": "反馈遗漏了本材料尚无防治建议，也没有措施适用条件、监测评价、代价或失效情形这一缺口。",
      "suggested_check": "教师确认本维是否应在本次片段中出现；若应出现，要求把候选措施对应到机制、对象、实施条件和监测指标，再比较适用性与复核需求，勿从文献直接移植工程参数。"
    }
  ],
  "teacher_questions": [
    "本次输入是完整作业还是报告片段？六维中哪些是本轮必须提交内容，哪些应补交或暂缓建议？",
    "请确认P01是学生主动提出的待核查错误命题还是仍保留的结论，并要求其明确写出核查后的条件性表述。",
    "草案量规尚待教师校准：请分别依据E01、A01及P02已有的正确边界，确定各维建议档位，避免六维统一最高档或因片段缺项统一扣至最低档。",
    "本次全部为合成演练；材料门槛仅按任务约定视为完成。请勿将结果纳入真实学生成绩、学习效果、课堂人数或66人发生率统计。"
  ]
}
